{
  "$schema": "https://json-schema.org/draft/2020-12/schema",
  "$id": "https://github.com/elicore/redis-web/raw/main/redis-web.schema.json",
  "title": "redis-web Configuration",
  "description": "Schema describing the supported configuration options for the Rust redis-web server.",
  "type": "object",
  "additionalProperties": false,
  "properties": {
    "$schema": {
      "type": "string",
      "description": "Path or URL to this schema file so editors can enable validation."
    },
    "redis_host": {
      "type": "string",
      "description": "Hostname or IP address of the target Redis server.",
      "default": "127.0.0.1"
    },
    "redis_port": {
      "type": "integer",
      "description": "TCP port of the target Redis server.",
      "minimum": 1,
      "maximum": 65535,
      "default": 6379
    },
    "redis_socket": {
      "type": "string",
      "description": "Filesystem path to a Redis UNIX-domain socket. When set, redis-web prefers this over redis_host/redis_port. TLS (ssl) is not applicable to UNIX sockets.",
      "minLength": 1
    },
    "redis_auth": {
      "description": "Authentication parameters passed to Redis. Use a password string for Redis < 6 or an array of [username, password] for ACL-based auth.",
      "oneOf": [
        {
          "type": "string",
          "minLength": 1
        },
        {
          "type": "array",
          "items": {
            "type": "string",
            "minLength": 1
          },
          "minItems": 2,
          "maxItems": 2
        }
      ]
    },
    "http_host": {
      "type": "string",
      "description": "Interface redis-web binds to for HTTP traffic.",
      "default": "0.0.0.0"
    },
    "http_port": {
      "type": "integer",
      "description": "Port redis-web listens on.",
      "minimum": 1,
      "maximum": 65535,
      "default": 7379
    },
    "transport_mode": {
      "type": "string",
      "description": "Selects which public surface redis-web exposes at startup.",
      "enum": [
        "rest",
        "grpc"
      ],
      "default": "rest"
    },
    "http_threads": {
      "type": "integer",
      "description": "HTTP concurrency setting used for Redis pool sizing and other HTTP-side capacity decisions.",
      "minimum": 1,
      "default": 4
    },
    "runtime_worker_threads": {
      "type": "integer",
      "description": "Override for the Tokio runtime worker-thread count. When omitted, Tokio chooses its default worker count.",
      "minimum": 1
    },
    "threads": {
      "type": "integer",
      "description": "Legacy alias for http_threads. Prefer http_threads; when both exist, http_threads takes precedence.",
      "minimum": 1,
      "deprecated": true
    },
    "pool_size_per_thread": {
      "type": "integer",
      "description": "Number of Redis connections allocated per HTTP worker thread.",
      "minimum": 1,
      "default": 10
    },
    "pool_size": {
      "type": "integer",
      "description": "Legacy alias for pool_size_per_thread. Prefer pool_size_per_thread; when both exist, pool_size_per_thread takes precedence.",
      "minimum": 1,
      "deprecated": true
    },
    "database": {
      "type": "integer",
      "description": "Redis logical database index selected after connecting.",
      "minimum": 0,
      "maximum": 255,
      "default": 0
    },
    "daemonize": {
      "type": "boolean",
      "description": "Legacy compatibility option. The canonical binary runs in the foreground; use your service manager if you need daemonization.",
      "default": false,
      "deprecated": true
    },
    "pidfile": {
      "type": "string",
      "description": "Legacy compatibility option. Process supervisors should manage PID files externally if they still need one.",
      "deprecated": true
    },
    "websockets": {
      "type": "boolean",
      "description": "Enable WebSocket endpoint (/.json) for Pub/Sub and command execution.",
      "default": false
    },
    "ssl": {
      "$ref": "#/$defs/sslConfig"
    },
    "acl": {
      "type": "array",
      "description": "Ordered list of ACL rules evaluated from top to bottom.",
      "items": {
        "$ref": "#/$defs/aclRule"
      }
    },
    "http_max_request_size": {
      "type": "integer",
      "description": "Maximum accepted HTTP request size in bytes.",
      "minimum": 1,
      "default": 134217728
    },
    "user": {
      "type": "string",
      "description": "Legacy compatibility option. Prefer your container or service manager for privilege separation.",
      "deprecated": true
    },
    "group": {
      "type": "string",
      "description": "Legacy compatibility option. Prefer your container or service manager for privilege separation.",
      "deprecated": true
    },
    "default_root": {
      "type": "string",
      "description": "Redis command executed when the root path (/) is requested, e.g. /GET/index.html."
    },
    "verbosity": {
      "type": "integer",
      "description": "Logging verbosity level (0=errors only, 4=debug, >=5 trace).",
      "minimum": 0,
      "default": 4
    },
    "logfile": {
      "type": "string",
      "description": "Legacy compatibility option. The canonical binary logs to stderr; use shell redirection or your service manager if you need a file.",
      "deprecated": true
    },
    "log_fsync": {
      "$ref": "#/$defs/logFsync",
      "deprecated": true
    },
    "hiredis": {
      "type": "object",
      "description": "Legacy Hiredis keep-alive settings kept for compatibility. When keep_alive_sec is set, redis-web configures TCP keep-alive on Redis TCP/TLS connections. This does not apply to UNIX sockets (redis_socket).",
      "properties": {
        "keep_alive_sec": {
          "type": "integer",
          "minimum": 1,
          "description": "Keep-alive idle time (seconds) used for Redis TCP/TLS connections. The probe interval is derived as approximately keep_alive_sec / 3 when supported by the platform."
        }
      },
      "additionalProperties": false
    },
    "compat_hiredis": {
      "$ref": "#/$defs/compatHiredisConfig"
    },
    "grpc": {
      "$ref": "#/$defs/grpcConfig"
    }
  },
  "$defs": {
    "aclRule": {
      "type": "object",
      "description": "ACL rule that can allow or deny commands based on HTTP auth and/or IP address.",
      "additionalProperties": false,
      "properties": {
        "disabled": {
          "type": "array",
          "description": "Redis commands disabled for clients matching this rule.",
          "items": {
            "type": "string",
            "minLength": 1
          },
          "minItems": 1
        },
        "enabled": {
          "type": "array",
          "description": "Redis commands enabled despite previous disabled matches.",
          "items": {
            "type": "string",
            "minLength": 1
          },
          "minItems": 1
        },
        "http_basic_auth": {
          "type": "string",
          "description": "Value for HTTP Basic Auth in the form username:password."
        },
        "ip": {
          "type": "string",
          "description": "IP address or CIDR range matched against the client."
        }
      }
    },
    "sslConfig": {
      "type": "object",
      "description": "Configuration for TLS connections to Redis.",
      "required": [
        "enabled",
        "ca_cert_bundle",
        "client_cert",
        "client_key"
      ],
      "additionalProperties": false,
      "properties": {
        "enabled": {
          "type": "boolean",
          "description": "Set to true to enable TLS when connecting to Redis."
        },
        "ca_cert_bundle": {
          "type": "string",
          "description": "Path to the CA certificate bundle used to validate Redis."
        },
        "path_to_certs": {
          "type": "string",
          "description": "Optional directory containing trusted CA certificates."
        },
        "client_cert": {
          "type": "string",
          "description": "Client certificate presented to Redis."
        },
        "client_key": {
          "type": "string",
          "description": "Private key corresponding to client_cert."
        },
        "redis_sni": {
          "type": "string",
          "description": "Override SNI hostname when negotiating TLS with Redis."
        }
      }
    },
    "logFsync": {
      "description": "Controls how aggressively redis-web fsyncs its logs. \"all\" can be very expensive.",
      "oneOf": [
        {
          "type": "string",
          "enum": [
            "auto",
            "all"
          ],
          "description": "Named fsync policies (\"auto\" = no explicit fsync, \"all\" = fsync after each log write)."
        },
        {
          "type": "integer",
          "minimum": 0,
          "description": "Fsync interval in milliseconds (fsync at most once per interval)."
        }
      ]
    },
    "compatHiredisConfig": {
      "type": "object",
      "description": "Configuration for the opt-in hiredis-compatible session bridge endpoints.",
      "additionalProperties": false,
      "properties": {
        "enabled": {
          "type": "boolean",
          "default": false,
          "description": "Enable or disable the /__compat session bridge. Leave unset or false to keep the bridge inactive."
        },
        "path_prefix": {
          "type": "string",
          "default": "/__compat",
          "description": "Path prefix for compat endpoints."
        },
        "session_ttl_sec": {
          "type": "integer",
          "minimum": 1,
          "default": 300,
          "description": "Idle session expiration timeout in seconds."
        },
        "max_sessions": {
          "type": "integer",
          "minimum": 1,
          "default": 1024,
          "description": "Maximum number of active compat sessions."
        },
        "max_pipeline_commands": {
          "type": "integer",
          "minimum": 1,
          "default": 256,
          "description": "Maximum commands accepted in one pipelined compat request."
        }
      }
    },
    "grpcConfig": {
      "type": "object",
      "description": "Configuration for the gRPC transport when transport_mode is set to grpc.",
      "additionalProperties": false,
      "properties": {
        "host": {
          "type": "string",
          "default": "0.0.0.0",
          "description": "Interface redis-web binds to for gRPC traffic."
        },
        "port": {
          "type": "integer",
          "minimum": 1,
          "maximum": 65535,
          "default": 7379,
          "description": "Port redis-web listens on for gRPC traffic."
        },
        "enable_health_service": {
          "type": "boolean",
          "default": true,
          "description": "Expose the standard gRPC health service."
        },
        "enable_reflection": {
          "type": "boolean",
          "default": false,
          "description": "Expose gRPC server reflection for debugging and tooling."
        },
        "max_decoding_message_size": {
          "type": "integer",
          "minimum": 1,
          "description": "Maximum accepted gRPC request size in bytes. Falls back to http_max_request_size when omitted."
        },
        "max_encoding_message_size": {
          "type": "integer",
          "minimum": 1,
          "description": "Maximum emitted gRPC response size in bytes."
        }
      }
    }
  }
}
