{
  "$schema": "./redis-web.schema.json",
  "redis_host": "127.0.0.1",
  "redis_port": 6379,
  "redis_auth": ["user", "password"],

  "http_host": "0.0.0.0",
  "http_port": 7379,

  "http_threads": 4,

  "acl": [
    {
      "disabled": [ "DEBUG" ]
    },
    {
      "http_basic_auth": "user:password",
      "enabled": [ "DEBUG" ]
    }
  ],

  "hiredis": {
    "keep_alive_sec": 15
  },

  "verbosity": 3
}
